{
  "$schema": "./clean-data-design.schema.json",
  "governs": "product_runtime",
  "artifactStatus": "design_only",
  "executionEnabled": false,
  "version": 2,
  "updated": "2026-10-09",
  "target": "Windows 10/11 x64; detect OS volume at runtime, C: in fixtures",
  "levels": [
    {
      "id": 1,
      "name": "Tiêu chuẩn",
      "short": "Temp và cache đã biết",
      "tempMinAgeDays": 7,
      "logMinAgeDays": 30,
      "defaultPolicy": "Only reproducible data; protected and running-app items skipped"
    },
    {
      "id": 2,
      "name": "Chuyên sâu",
      "short": "Thêm cache hệ thống và công cụ",
      "tempMinAgeDays": 7,
      "logMinAgeDays": 14,
      "defaultPolicy": "Adds supported system providers; admin through UAC; opt-in for developer caches"
    },
    {
      "id": 3,
      "name": "Tối đa có duyệt",
      "short": "Thêm dữ liệu cũ cần quyết định",
      "tempMinAgeDays": 3,
      "logMinAgeDays": 7,
      "defaultPolicy": "Risky categories stay unchecked; item-level review, backup or explicit permanent deletion"
    }
  ],
  "executionContract": {
    "manifestTtlMinutes": 10,
    "quarantineRetentionDays": 14,
    "maxConcurrentOperations": 1,
    "scanThreads": 2,
    "scanMemoryBudgetMB": 150,
    "followReparsePoints": false,
    "alterAcl": false,
    "bypassUac": false,
    "autoKillApps": false
  },
  "fixtureRows": [
    {
      "id": "temp",
      "title": "File tạm của người dùng",
      "path": "%TEMP% • ≥ tuổi theo mức dọn",
      "level": 1,
      "mb": 1340,
      "kind": "cache",
      "admin": false,
      "review": false,
      "default": true,
      "method": "delete",
      "evidence": "Root Known Folder + LastWriteTime + không có file đang ghi",
      "effect": "Cache tái tạo được; file mới/khóa được bỏ qua.",
      "skipMb": 90,
      "risk": "safe",
      "dataClass": "cache"
    },
    {
      "id": "logs",
      "title": "Log đã rotate / log chẩn đoán cũ",
      "path": "Cache/log của app có rule đã kiểm chứng",
      "level": 1,
      "mb": 430,
      "kind": "cache",
      "admin": false,
      "review": false,
      "default": true,
      "method": "delete",
      "evidence": "Rule vendor + log đã đóng + quá tuổi giữ lại",
      "effect": "Mất log cũ phục vụ chẩn đoán; giữ log mới và log đang ghi.",
      "skipMb": 0,
      "risk": "safe",
      "dataClass": "cache"
    },
    {
      "id": "browser",
      "title": "Disk cache trình duyệt",
      "path": "Chỉ Cache / Code Cache có rule của profile",
      "level": 1,
      "mb": 1860,
      "kind": "cache",
      "admin": false,
      "review": false,
      "default": true,
      "method": "delete",
      "evidence": "Nhận diện profile; app phải đóng; không đụng Cookies/History/Login Data",
      "effect": "Trang web có thể tải chậm lần đầu; giữ đăng nhập, lịch sử và mật khẩu.",
      "busy": "browser",
      "skipMb": 0,
      "risk": "safe",
      "dataClass": "cache"
    },
    {
      "id": "wer",
      "title": "Crash dump và báo cáo lỗi cũ",
      "path": "%LOCALAPPDATA%\\CrashDumps + WER đã lưu",
      "level": 2,
      "mb": 1190,
      "kind": "cache",
      "admin": false,
      "review": true,
      "default": false,
      "method": "delete",
      "evidence": "Report hoàn tất; retention; không đang điều tra lỗi",
      "effect": "Mất dữ liệu crash cũ; có nút giữ lại log/dump cần điều tra.",
      "skipMb": 0,
      "risk": "review",
      "dataClass": "cache"
    },
    {
      "id": "wintemp",
      "title": "Windows Temp / WER hệ thống",
      "path": "%SystemRoot%\\Temp; WER archive được hỗ trợ",
      "level": 2,
      "mb": 1650,
      "kind": "cache",
      "admin": true,
      "review": false,
      "default": true,
      "method": "delete",
      "evidence": "Root cho phép + admin hợp lệ + file ổn định, không khóa",
      "effect": "File thiếu quyền/đang dùng vẫn bỏ qua; không sửa ACL.",
      "skipMb": 150,
      "risk": "safe",
      "dataClass": "cache"
    },
    {
      "id": "delivery",
      "title": "Delivery Optimization cache",
      "path": "Provider Windows, không xóa thư mục service thủ công",
      "level": 2,
      "mb": 2340,
      "kind": "cache",
      "admin": true,
      "review": false,
      "default": true,
      "method": "windows",
      "evidence": "Cmdlet/provider tồn tại và không có update đang chạy",
      "effect": "Có thể cần tải lại nội dung; hủy ở ranh giới provider.",
      "busy": "update",
      "skipMb": 0,
      "risk": "safe",
      "dataClass": "cache"
    },
    {
      "id": "dev",
      "title": "Cache công cụ phát triển",
      "path": "NuGet / package cache theo CLI vendor",
      "level": 2,
      "mb": 3180,
      "kind": "rebuild",
      "admin": false,
      "review": true,
      "default": false,
      "method": "delete",
      "evidence": "SDK tồn tại; không build/restore; chọn đúng cache root",
      "effect": "Cần tải/restore package lại; không xóa source hoặc node_modules hàng loạt.",
      "skipMb": 180,
      "risk": "review",
      "dataClass": "cache"
    },
    {
      "id": "component",
      "title": "Component store / update cũ",
      "path": "DISM AnalyzeComponentStore → StartComponentCleanup",
      "level": 2,
      "mb": null,
      "kind": "system",
      "admin": true,
      "review": true,
      "default": false,
      "method": "windows",
      "evidence": "Servicing capability; không reboot/update pending; estimate do Windows cung cấp",
      "effect": "Không cộng size WinSxS từ Explorer; không dùng ResetBase trong MVP.",
      "busy": "update",
      "skipMb": 0,
      "risk": "review",
      "dataClass": "cache"
    },
    {
      "id": "installers",
      "title": "Bộ cài tải về cũ — file được chọn",
      "path": "Downloads: setup-old.iso, vendor-old.exe (fixture)",
      "level": 3,
      "mb": 7280,
      "kind": "personal",
      "admin": false,
      "review": true,
      "default": false,
      "method": "delete",
      "evidence": "Tuổi 180 ngày là gợi ý; người dùng chọn file cụ thể, không chỉ extension",
      "effect": "Có thể mất bộ cài offline; không phải C:\\Windows\\Installer.",
      "skipMb": 0,
      "risk": "review",
      "dataClass": "cache"
    },
    {
      "id": "orphan",
      "title": "Dữ liệu còn sót của app đã gỡ",
      "path": "%LOCALAPPDATA%\\ExampleRemovedApp (fixture)",
      "level": 3,
      "mb": 3320,
      "kind": "appdata",
      "admin": false,
      "review": true,
      "default": false,
      "method": "quarantine",
      "evidence": "Ứng viên: đối chiếu HKCU/HKLM 32/64-bit + MSIX + app identity; thiếu uninstall key chưa đủ",
      "effect": "Có thể chứa save/settings/database; phải duyệt app và chọn sao lưu/giữ/xóa.",
      "skipMb": 0,
      "risk": "danger",
      "dataClass": "userdata"
    },
    {
      "id": "bin",
      "title": "Recycle Bin của user trên C:",
      "path": "Chỉ SID hiện tại / OS-volume; không dọn user khác",
      "level": 3,
      "mb": 2740,
      "kind": "personal",
      "admin": false,
      "review": true,
      "default": false,
      "method": "delete",
      "evidence": "Duyệt nội dung và tuổi giữ; provider Shell hỗ trợ",
      "effect": "Mất khả năng khôi phục các mục đã duyệt trong thùng rác.",
      "skipMb": 0,
      "risk": "review",
      "dataClass": "cache"
    },
    {
      "id": "oldwindows",
      "title": "Previous Windows installation / Windows.old",
      "path": "Storage / Disk Cleanup provider Windows",
      "level": 3,
      "mb": 12600,
      "kind": "rollback",
      "admin": true,
      "review": true,
      "default": false,
      "method": "windows",
      "evidence": "OS hỗ trợ; người dùng chấp nhận mất quay lui phiên bản Windows",
      "effect": "Không thể dùng dữ liệu này để quay lui phiên bản trước sau khi dọn.",
      "busy": "update",
      "skipMb": 0,
      "risk": "danger",
      "dataClass": "cache"
    },
    {
      "id": "installerstore",
      "title": "Windows Installer / Package Cache",
      "path": "C:\\Windows\\Installer; vendor repair cache",
      "level": 1,
      "mb": 8640,
      "kind": "protected",
      "admin": false,
      "review": false,
      "default": false,
      "method": "blocked",
      "blocked": "Cần cho sửa/gỡ/cập nhật; không phân loại là rác.",
      "risk": "blocked",
      "dataClass": "protected"
    },
    {
      "id": "unknownvendor",
      "title": "Thư mục AppData chưa nhận diện",
      "path": "%APPDATA%\\SharedVendor (fixture)",
      "level": 1,
      "mb": 2460,
      "kind": "protected",
      "admin": false,
      "review": false,
      "default": false,
      "method": "blocked",
      "blocked": "Chưa chứng minh chủ sở hữu; có thể shared runtime hoặc app portable.",
      "risk": "blocked",
      "dataClass": "protected"
    },
    {
      "id": "cloud",
      "title": "Dữ liệu OneDrive / Documents / source",
      "path": "Known Folders, sync root, workspace, save game",
      "level": 1,
      "mb": 5890,
      "kind": "protected",
      "admin": false,
      "review": false,
      "default": false,
      "method": "blocked",
      "blocked": "Dữ liệu cá nhân/cloud; đề xuất Free up space của OneDrive, không xóa trong Clean.",
      "risk": "blocked",
      "dataClass": "protected"
    },
    {
      "level": 3,
      "kind": "cache",
      "admin": false,
      "review": false,
      "default": true,
      "method": "delete",
      "risk": "safe",
      "dataClass": "cache",
      "skipMb": 0,
      "id": "removedcache",
      "title": "Cache app đã gỡ — chủ sở hữu xác minh",
      "path": "%LOCALAPPDATA%\\ExampleRemovedApp\\Cache (mẫu)",
      "mb": 980,
      "verifiedUninstalled": true,
      "evidence": "Inventory + vendor owner khớp; không còn process/service/task dùng; chỉ cache tái tạo",
      "effect": "Dọn cache còn sót, không có database/save/settings. Không popup cảnh báo."
    },
    {
      "level": 3,
      "kind": "cache",
      "admin": false,
      "review": false,
      "default": true,
      "method": "delete",
      "risk": "safe",